{
  "schema_version": "1.0",
  "request_id": "req_inbox_demo_001",
  "checkpoint": "outlook-delta-demo-001",
  "events": [
    {
      "provider": "outlook",
      "account_id": "demo@example.com",
      "conversation_id": "conversation-demo-001",
      "provider_message_id": "message-demo-001",
      "sender": "colleague@example.com",
      "recipients": ["demo@example.com"],
      "subject": "周五演示确认",
      "content": "请在周五上午十点前确认演示材料，并回复最终版本。",
      "received_at": "2026-07-24T09:30:00+08:00",
      "coverage": {
        "source": "official_api",
        "complete": true,
        "note": null
      }
    }
  ]
}
